ID,Title,Location,Salary,Summary
eb3d25a39537af28,테크니컬 커뮤니케이터,마움 서울 송파구,"연봉 21,550,000원 - 25,000,000원","[웹프로그래밍] - jsp, java, ASP / PHP 개발 능숙자 - HTML, JavaScript, css 능숙자 - MS SQL, Oracle, MySQL 등 DBMS 설계 및 운영 가능자 - 웹, DB서버 구축 및..."
d6c05c588971df5a,백엔드 파운트 시스템 엔지니어 (현재 급여수준 이상 보장),파운트 서울 충정로역,,"능숙 우대사항 - Python, Java등을 이용한 프로그래밍 경험 네트... 명령어 및shell스크립트 작성 능숙 우대사항 - Python, Java등을 이용한 프로그래밍 경험 네트워크및 서버에 대한 표준화및 운 표준 구성..."
bd02f70d5497dd6c,"대기업 백엔드개발( Spring, Java, Restful ) 및 일본어...",차량IT 전문 기업 (대기업) 서울,,"가능합니다) - 일본어 가능자 - Spring 기반 Java Application 개발 (경력 4년 이상) - 오픈 소스 활용 능력 - 개발언어: Java, Jsp - RDBMS 및 NoSql 개발 역량 - Restful..."
281fb1cb3dff0cf8,글로벌&모바일 플랫폼 운영을 담당할 를 합니다.,Nexon 성남 분당구,,"및 운영(AWS, Azure, GCP) - 서비스 운영(Jetty, JAVA, NginX, Kong 등) - 주요 성능지표 모니터링, 분석, 트러... 장애처리 경험자 >Jetty, JAVA, NginX, Kong 등 WEB..."
e36af236652e8e9d,Data Analyst (CRM),Coupang 3.1 서울,,"Experience using a programming language (R, SAS, Python, Java, etc... automation, job scheduling, and statistical analysis..."
ca4f46dbb14afa0b,Delphi/웹 개발자(신입/경력),씨아이에스텍 서울 금천구,,"경험자 기본조건 (웹) - Java, Jsp 개발 가능자 우대조건... 바일·게임>웹프로그래머>JSP|인터넷·IT·통신·모바일·게임>웹프로그래머> JAVA|인터넷·IT·통신·모바일·게임>웹프로그래머>백엔드|인터넷·IT·통신..."
dbe0f6f7da20d201,"Principal, Back-end Engineer (Seller Por...",Coupang 3.1 서울,,Expert with one or more programming language... Java/Python/Scala * Understanding of architectural principles and design...
3d2eda8e40d44cce,자바개발자 채용(정보전략 경력),아이마켓코리아 서울 강남구,,"개발 ㆍ관리자 사이트 운영 및 개발 ㆍ공급사 SCM 운영 및 개발 [자격요건] - 전문학사 졸업 이상 -WEB, JAVA, JSP 개발경력 4년이상 - ORACLE DB 사용 경험자 - 쇼핑몰 운영 개발 경력자 [우대사항..."
2239cda11284bf80,Web Project Manager (Senior/Junior) (M/F...,Datawords 서울,,"one... following programming languages: HTML/CSS, JS, PHP, Java Excellent oral and written communication skills Fluency..."
d414d702649a6bd5,JAVA 프로그래머 수시-가산디지털단지역,연우정보기술 서울 강남구,,연우정보기술(주) 모집부문 및 자격요건 담당업무 자격요건 인원 JAVA 프로그래머 모집 [자격요건] 경력사항: 경력(3년 이상 12년 이하... 통신·모바일·게임>웹프로그래밍> JAVA|인터넷·IT·통신·모바일·게임>웹프...
19b93db9fb547677,시크릿차트와 함께할 개발자,시크릿차트 서울 강남구,,요한 현 시점에서 당신이 꼭 필요합니다. Ios / Android / java / php / jQuery / MySQL / Redis / nginx... 있습니다. Ios / Android / java / PHP / jQuery...
6cbcd87710d2b5bb,"백엔드, JAVA 신입/경력 정규직",지금컴퍼니 수원 영통구,,"JAVA 신입/경력 정규직 채용 모집부문 및 자격요건 담당업무 자격요건 인원 [담당업무] 1. 주업무: - 부하테스트 및 Backend , JAVA... 웹프로그래머>백엔드|인터넷·IT·통신·모바일·게임>응용프로그래머> JAVA"
1df170713ece63bc,"[(주)넷아이디] iOS 개발자 신입/경력 정규직, 계약직",넷아이디 서울 강남구,,"사항: 대학교(4년)졸업 이상 연령: 무관 성별: 무관 -swift, objective-c 개발 경험자 - JAVA, C 언어 사용 가능자 [우대사항] 전공계열: 공학계열 iOS 앱 개발 및 배포 경험자 매킨토시 사용..."
43d834fc1f4c2e8b,2020년 미국 대학 입시 담당자(에세이 카운슬러),인사이트컨설팅 서울 강남구,,"관련 프로젝트 경험자 - 사업기획서 작성 가능자 - 제안서 작성 능숙자 [응용 프로그래밍] - C, C++, JAVA, 임베디드 개발 유경험자 - .NET 프레임워크에 대한 기반 지식 보유자 - 네트워크 프로그래밍에 대한..."
3a3a5a38df83d85f,"Software Engineering Manager, Mobile",SendBird 서울,,Android or Javascript * Proficient in Objective-C or Swift or Java or Javascript with strong object-oriented design skills...
b0689e759c272ef5,[온라인공채] ZUM 검색플랫폼 개발(신입),미래에셋제5호기업인수목적 서울 서초구,,"이터 분산 처리 플랫폼 개발 - 신규 서비스 플랫폼 개발 자격조건 - Java, Python 등의 프로그래밍 랭귀지 사용이 가능한 분 - 남다른 호기... 통신·모바일·게임>응용프로그래머> JAVA|인터넷·IT·통신·모바일·게임..."
ecd6fb1a0fe8a06b,Solutions Engineer Manager (APAC),SendBird 서울,,"programming language... JavaScript, Swift, Objective C, Java, Kotlin, or C# * You have working knowledge... least one..."
a0427584e85a0d53,안드로이드 개발자,myrealtrip 서울,,product) [자격요건] Android 개발 경험이 있는 분 Java에 대한 이해를 갖추고 Kotlin 언어 사용이 가능한 분 앱 성능 최적화... 결합니다. [기술 스택] Kotlin Java MVI Coroutine...
73ecc36bb6231f81,"Principal, QA Engineer (Seller Portal)",Coupang 3.1 서울,,"least one another programming language... Java, C#, and Python Preferred: * Experience... advertising..."
5ba060c7315de8f3,중화권 대상 쇼핑 플랫폼 카요 BackEnd 개발 부문,카요 서울 종로구,,"중 대표 기업으로 발전 중인 카요에 참신한 아이디어와 열정을 가진 분들의 지원을 기다립니다. 담당업무 - JAVA 프로그래머 - 웹서비스 개발 및 유지보수 자격요건 - Spring,Mybatis,Restful 어플리케..."
d39622eea8d9be7f,LTE/5G Network Management S/W 개발 EMS App...,무선인터넷 통신장비 제조기업 성남 분당구,,개발자 (필수) [우대요건] 3. Embeded WEB(CGI 기술) 개발 유 경험자 (우대사항) 4. Java Application 개발자 (우대사항) • 접수방법 1. 이력서(사진첨부 / 연락처 및 희망 연봉기재) 2...
9dd633cc1609a4c0,(주)스핀어웹 연구개발,스핀어웹 서울 영등포구,"연봉 24,000,000원 - 26,000,000원","[응용 프로그래밍] - C, C++, JAVA, 임베디드 개발 유경험자 - .NET 프레임워크에 대한 기반 지식 보유자 - 네트워크 프로그래밍에 대한 경험자 - DB 설계 및 DBMS(MS-SQL, MySQL, ORACLE)에..."
8660dff33c524786,IT본부 경력 모집(파생상품),유안타증권 서울 을지로2가,,"학위 취득자 -해당분야 경력 3년 이상(대리~과장급) -국내, 해외 파생상품 백오피스 개발 운영 경험자 - Java,Miplatform, Spring 기반 Framework, C, Oracle DBMS 프로그램 경험자..."
8fe1140b511ec280,소프트웨어 프로그램 개발자 경력사원,퍼시픽솔루션 안양 동안구,"연봉 44,000,000원 - 46,000,000원","방법 직무/산업 직무별(직종) 응용프로그래머VisualC, VisualC++, VisualBasic, C, C++, MFC, PowerBuilder, Java, .NET, Tuxedo 산업별(업종) 전기.전자.제어 가전제품"
e620d8b4b000a53c,웹개발 파트리더 경력직,베이리스 성남 수정구,,담당업무 자격요건 인원 [담당업무] [웹 개발 파트 리더] - Java Spring Boot Framework 능숙자 - Javascript... 통신·모바일·게임>웹프로그래머> JAVA|인터넷·IT·통신·모바일·게임>웹프...
e0adc36df891f6e1,2020년 상반기 AI/기획/데이터분석 부문 인재모집,신세계아이앤씨 서울 회현동,,"3D기반 개발경력 3년 이상 ※ 상기 요건 中 일부 경험자 지원가능 *우대사항 - C#/C/C++, Java 프로그래밍 개발경력 - HMD 어플리케이션 개발 경력 근무조건 - 근무형태 : 정규직 - 근무지역 : 서울..."
6b5f3622f6735c69,웹개발자 팀장급,게임회사 서울 송파구,,"년 이상, JSP/ JAVA 10년 이상, Spring 또는 전자정부 2년 이상 - Oracle 5년 이상 - 팀장 경력자 - 정보처리기사 자격증 보유자 - 정규직 [ 키워드 ] - JSP/ JAVA [ 우대조건 ] - 플스..."
e010f7780d479126,검색서비스 서버 개발 신입/경력,포티투마루 서울 관악구,,"가능) - 성별 : 무관 - 모집인원 : 0명 [기술 지원자격] - Linux 환경 개발 경력 - C/ Java/Python 개발 경력 - 서버 개발/운영 경력 [우대사항] - 자연어처리, 정보검색, 기계학습..."
18d8e70e9d6b8d7d,Senior Engineer (Back-end),Tapjoy 서울,,"interest in Java, and interfacing... Engineering experience (preferably with Java) • Strong knowledge of data structures..."
2861d53365dacec3,모드니 사회적협동조합 경력직 및 계약직 직원,모드니사회적협동조합 서울,,접수양식: 인크루트 이력서 기타 유의사항 입사지원서 및 제출서류에 허위사실이 있을 경우 채용이 취소될 수 있습니다. 인터넷·IT·통신·모바일·게임>웹프로그래머>JSP|인터넷·IT·통신·모바일·게임>웹프로그래머> JAVA
7f28afa9faba22bd,모바일앱 분석툴 유저해빗 웹개발자,유저해빗 서울 마포구,,인터넷·IT·통신·모바일·게임>웹프로그래머>Python|인터넷·IT·통신·모바일·게임>웹프로그래머>JSP|인터넷·IT·통신·모바일·게임>응용프로그래머>Objective-C|인터넷·IT·통신·모바일·게임>응용프로그래머> JAVA
182fcb737b5db5c5,빅데이터부문 직원,엔텔스 서울 강남구,,"록하기 지원양식 커리어 온라인 이력서 전형절차 및 제출서류 전형절차 직무/산업 직무별(직종) 응용프로그래머응용프로그래머, Java 시스템분석.설계.SE시스템엔지니어, SE 산업별(업종) 솔루션.ASP.소프트웨어 소프트웨어개발"
314cb11dce58741e,서버 웹 애플리케이션 개발,픽셀로 경기도 의왕,,"없음.비젼이 있는 회사 서버 웹 애플리케이션 개발... Web Application Server) 개발 - Java/Spring, Html/css/Node.js/javascript - RDBMS - Mobile app..."
6ddd6cc2b78a4dcb,블록체인 시스템 엔지니어 양성과정,에프앤이노에듀 서울,,게임>웹프로그래머>ASP|인터넷·IT·통신·모바일·게임>웹프로그래머> JAVA|인터넷·IT·통신·모바일·게임>웹프로그래머>.NET|인터넷·IT·통신... 통신·모바일·게임>응용프로그래머> JAVA|인터넷·IT·통신·모바일·게임...
063f5fc7ff671cd4,(펜타시큐리티) DB보안제품개발,펜타시큐리티시스템 서울 영등포동,,"트웨어 개발 경력 3년 이상 -C/C++ 개발 언어에 익숙한 분 *우대사항 -도전적이고 진취적인 분 - Java, Python 등의 개발 언어를 사용해 본 경험이 있는 분 -보안 제품 개발 경험 또는 보안 지식이 많은..."
d67095fece86c067,"경력 6개월 이상 JAVA, DELPHI 개발자[웹, 모바일앱] (정직원...",하이앤씨아이티 서울 강남구,,"기사/기능사 자격증 보유자 우대 하이앤씨아이티(주) 채용중경력 6개월 이상 JAVA, Delphi 개발자[웹, 모바일앱] 채용 (정직원 및 프리랜서) 모집... 통신·모바일·게임>웹프로그래머> JAVA|인터넷·IT·통신·모바일·게임>웹프..."
08631f1c71593bb0,IT연구개발 분야 정규직 채용,현대엔지비 서울 신림동,,지자(전공무관) -해외여행 및 근무에 결격사유가 없으신 분 -남자의 경우 군필 또는 면제자 *필요기술(역량) - java(Spring) 기반 Back End 개발 역량 보유 -SQL 작성 및 DB 설계/튜닝 역량 보유...
7968637e145dfbe0,JAVA 경력 개발자 (3년이상),더유니파이 서울 금천구,,업무 자격요건 인원 [담당업무] JAVA & Web 개발 [자격요건] 경력... 통신·모바일·게임>웹프로그래머> JAVA|인터넷·IT·통신·모바일·게임>웹프로그래머>JSP|인터넷·IT·통신·모바일·게임>응용프로그래머> JAVA
106abbac17334486,[온라인공채] ESTsecurity 웹프론트 개발 (경력),이스트시큐리티 서울 서초구,,"외의 개발언어 활용이 가능하신 분 (Typescript, Python, Java 등) - 백앤드 서비스, DB(RDBMS, NoSQL)에 대한 이해와... 통신·모바일·게임>웹프로그래머> JAVA|인터넷·IT·통신·모바일·게임>웹프..."
2aa898393deb8097,Mobile App Engineer (React Native/React),Soomgo 서울 강남구,,"협업을 잘 하실 수 있는 분 우대사항 • 모바일 네이티브 언어(Swift, Objective C, JAVA) 개발 경험이 있는 분 • 상용 모바일 앱 개발 및 출시 경험이 있는 분 • 속도 향상을 위한 최적화에 대한..."
4a67bd58b7cc7224,공포게임 3D 그래픽디자이너 신입,나이젤 뱅크 서울 노원구,"연봉 22,000,000원 - 24,000,000원","기재 직무/산업 직무별(직종) 게임기획.개발.운영게임음악.음향, 게임디자인, 2D디자인, Flash게임, Java게임, 모바일앱게임, 온라인게임, 게임개발, 멀티미디어 캐릭터디자인3D 산업별(업종) 문화.공연.예술 공연예술"
49fa26d981f65ae7,Python 백앤드엔지니어,케이원파트너스 서울 서초구,,"서버 시스템 개발/유지보수/운영 l 대용량 서비스에 적합한 server 아키텍처 구현 l Python, Java, Ruby, Node.js 등을 사용한 5년 이상의 개발 경력 l Web framework (Django..."
1b64564d3e3a497c,Backend,리테일-테크회사 서울 강남구,,"처리 - Docker를 이용해 빌드, 디플로이, 메인터넌스를 담당 - Java, Dropwizard 프레임워크를 이용한 API 서버개발 - Ruby... 웹 애플리케이션 개발 경험 - Java, Scala, Javascript..."
ccc373ef19c10bbf,Developer (Cloud Contact Center),Ericsson 서울,,Base Schema Handling Programming Language: Java Servlet / Linux / Tomcat / MySQL... 베이스 스키마 처리 프로그래밍 언어: Java Servlet / Linux...
61715d3ff9a34ea4,"JAVA BackEnd Front End 개발자 SW 개발 플랫폼, 협업...","- ISO 26262, ASPICE Automotive SPICE, IEC 62304, C... 서울 중구",,"JAVA BackEnd Front End 개발자 • 회사소개 - 5년차... 서울 중구 장충동 • 포지션 - 사세확장으로 인한 신규채용 - Java 백 엔드 개발자, 프론트 개발자 / 각 1명 - 직급 : 대리, 과장, 차장..."
b28ac7f3dd36db06,리눅스 개발,산업자동화 PLC 및 자동감시제어 소프트웨어 개발사 서울 송파구,,요건] - 학사 학위 이상 - 유관 경력 5년 이상 - 리눅스 OS 포팅 가능자 - Qt 개발 경험자 - C++/ JAVA 고급 개발자 [전형절차] 서류전형 - 면접전형 - 인적성 - 최종합격 [제출서류] 국문이력서(자기소...
5123207a169f90eb,Software Developer - Front-End / Back-En...,AITRICS 서울,,"general purpose programming languages including C++, Java, Javascript, Python. Eager to learn a new programming language..."
618155524248ed6f,웹개발 대리~과장급,시스템 백업 복원 솔루션 업체 성남 분당구,,"학력 : 초대졸(2년제) 이상 - 경력 : 5년 이상 - JAVA/JSP 개발 경력자(Spring, Mybatis 프레임워크) - HTML5, jQuery, java-script 가능자 - Node.js 가능자 - MS..."
d498993697237b33,AI(인공지능) 개발자,휴먼디지털 서울,,기업정보 국내 IT 기업 업무내용 인공지능(챗봇) 개발 자격조건 학력 : 4년제 대졸이상 - 경력 : 1. Java 개발 경력 3년 이상 2. 비지니스 영어 가능한 분 3. 인공지능 개발에 관심이 많은 분 [우대사항] 1...
7b754fcbbd65e591,백엔드 개발자 - API 연동 플랫폼 개발,myrealtrip 서울,,준하는 역량을 보유하신 분 API 연동 경험이 풍부하신 분 (다양한 제휴사의 API 스펙 연동 경험이 있으신 분) Java와 Spring Framework에 대한 개발 경험을 갖고 계신 분 [우대사항] Reactive...
673583ea33eb556a,링크샵스 백엔드(Backend) 개발 및 유지보수 담당,링크샵스 서울 중구,,"Nodejs 실무 2년이상, 실무DB 모델링 경험, AWS 경험 • Elasticsearch/NoSQL 경험 • Java script 개발경험 • 비동기식 대용량 요청을 처리 환경(API 등을 통한)에 대한 경험 • 버전관리..."
34c6ef82127ac0c1,Software Engineer - Android Messaging SD...,SendBird 서울,,"framework changes, build tools, and libraries * Proficient in Java with strong object-oriented design skills * Able to work..."
40415b76893de1f4,"IOS /MAC 프로그램 개발, Android / Java 프로그램 개발...",코이노 서울 구로구,,요건 인원 IOS /MAC 프로그램 개발 (1명) Android / Java 프로그램 개발(2명) MFC/Visual C++ (1명) [담당업... 통신·모바일·게임>응용프로그래머> JAVA|인터넷·IT·통신·모바일·게임...
7a08f5e589b10a00,"Senior, Software Engineer (Search Qualit...",Coupang 3.1 서울,,"소지자 * 알고리즘, 시스템 설계, 분산환경에서 3년 이상의 실무 경험 * Java, Scala, Python 등의 객체 지향 언어에서 3년 이상의... Oriented language, Java, Scala, Python..."
9bcdc86d62934430,통신 관련 웹플랩폼 개발 담당자(대리-차장),국내 유명 IT기업 서울,,"개발 2.자격요건 - 관련경력 5년~13년 - 형상 관리(GIT)에 대한 전문적인 경험자 - Node.js, Java, Linux, MySQL 전문적인 개발 경험자 - 풍부한 Network 지식 보유자 - 빌링 플랫폼 개발..."
212ca67d161b7162,2020 Market Data Analyst - Seoul (Korean...,Bloomberg 서울,,"languages (e.g. Python, R, JavaScript, Java) Ability to recognize opportunities... R, JavaScript, Java) as well as SQL..."
114ba46815186a3f,개발 부문(신입/경력직),미래아이티 수원 영통구,"연봉 26,000,000원","수원시 영통구 창룡대로 광교센트럴비즈타워 1006호 인근지하철 직무내용 1) ERP 업무 개발자 (C#, JAVA) 2) 중소기업 ERP 컨설팅 우대 사항 1) 신입사원: 정보처리 기사 소지자 2)경력사원: 중소기업 ERP..."
eec475b8f3083300,DX혁신부문 Tech Lab Senior Web & Server Deve...,이투스교육 서울 강남구,,"Development] - 객체지향 프로그래밍 설계 능력 - 데이타베이스 언어 성능 튜닝 능력 - Java, Spring Framework 3.x 이상 환경 Service/API 설계 능력 - Spring..."
de80829dfb03d602,[온라인공채] ESTsecurity 서버 백엔드 개발 (경력),이스트시큐리티 서울 서초구,,"준하는 역량을 갖추고 계신분 - Java 언어를 잘 다루시거나 타 JVM... 에 대한 이해가 있으신 분 - CI/CD에 대한 이해가 있으신 분 - Java 이외의 개발언어 활용이 가능하신 분 (JavaScript, Python..."
8c2290a39b46b358,JAVA 웹개발자 고급,해외송금 전문업체 서울 강남구,,"Position : JAVA 웹개발자 고급 ? [ 담당업무 ] - Web 개발 [ 자격요건 ] - 개발 경력 10년 이상, JSP/ JAVA 5년... 정규직 [ 키워드 ] - JSP/ JAVA [ 우대조건 ] - AA 경험..."
cac72f417e3a6e47,알고리즘 엔지니어,한비젼 서울 서초구,"연봉 26,000,000원 - 28,000,000원","직무/산업 직무별(직종) 응용프로그래머VisualC, VisualC++, VisualBasic, C, C++, MFC, PowerBuilder, Java, .NET, Tuxedo 산업별(업종) 컴퓨터.하드웨어.주변기기 컴퓨터"
dcbce45dbe2d3679,Senior Full-Stack Developer,Asiance 서울,,"등의 CMS도 사용. • Python, Node.js, Java, PHP for backend development. • Python, Node.js, Java, PHP 등을 사용하여 백엔드 . • MySQL..."
e9b3c569fb7e0ad2,[개발팀] Full Stack 개발자,심플렉스 서울 동작구,,Infrastructure as Code 구현 자격요건 - 경력무관 - 개발(WEB/Frontend/Backend/ JAVA/PHP/NODE/GO/ETC) - Linux 기반의 Open Source Software 개발 및...
440c7485ae06b439,Back-End Web 개발자,한국사이버결제 서울 구로구,,"및 유지 보수 업무 자격요건 - 경력사항 : 만 4 ~ 10년 (대리 ~ 과장) - 개발언어 : Java, Javascr-ipt, jQuery - 데이터베이스 : RDBMS - fra-mework : Spring..."
511924bcc0063c9f,엑스플랫폼/넥사크로 개발 경력자,에프티에치코리아 용인 처인구,,"지원양식 커리어 온라인 이력서 전형절차 및 제출서류 전형절차 직무/산업 직무별(직종) 웹프로그래머JSP, JAVA, MS-SQL 응용프로그래머전산전공, Oracle HTML코딩.퍼블리셔자바스크립트 산업별(업종) 솔루션.ASP..."
2c144999e397bf78,RPA(업무자동화) 엔지니어,에스티에이테스팅컨설팅 서울 강남구,,"지원양식 커리어 온라인 이력서 전형절차 및 제출서류 전형절차 직무/산업 직무별(직종) 웹프로그래머HTML 응용프로그래머전산전공, Java 시스템분석.설계.SE시스템엔지니어 산업별(업종) 솔루션.ASP.소프트웨어 소프트웨어개발"
ab49b98cb0baa037,[종로구/대기업건설사] 웹 개발자 (대리급),KIAC 서울,,래머> JAVA|인터넷·IT·통신·모바일·게임>웹프로그래머>백엔드|인터넷·IT·통신·모바일·게임>웹프로그래머>ASP|인터넷·IT·통신·모바일·게임>웹프로그래머>.NET|인터넷·IT·통신·모바일·게임>응용프로그래머> JAVA|인터...
46e64783bd9d2d0d,데이터 전문가 경력,LG CNS 3.7 서울,,"데이터 PaaS 서비스 활용 아키텍처 설계/검증/구축 ⑤ Linux 기반 빅데이터 플랫폼 개발, 주 언어는 Java/Python 기반 필수요건 ①빅데이터 플랫폼 개발 또는 아키텍트 경험 3년 이상 우대사항 (해당 내용 중 1..."
204308e277d085e3,DevOps Consultant - Professional Service...,Amazon Web Services Korea LLC 서울,,"scripting languages... Shell, Python, Ruby, Perl, Java, .Net, or C++. · Experience with building and managing release..."
e4b29f01fdce0cfc,[TmaxA&C/Space사업본부] 제품 QA 인턴,티맥스소프트 성남 분당구,,"도출 테스트 시나리오 기획/작성, 테스트 및 관리 진행 성능 테스트의 기준 수립 및 테스트 진행 자격요건 Java 또는 C 언어를 이용하여 프로그래밍 가능자 IT 관련학과 전공자 QA업무에 대한 이해도가 있으신 분..."
f8d8cbfce9b1c143,Site Engineering Leader,Wish 서울,,"CSS JavaScript / JS Libraries (angular, etc) Python Go (Golang) Java Spark MongoDB RESTful API AWS About you... an..."
1c21a244a72f1783,운영 개발자,Feelway 서울,,"Javascript Framework, Git, Docker 의 경험 우대사항 • 쇼핑몰, 이커머스 근무 경력 • Java개발 경력 채용절차 • 서류합격 -> 스크리닝 테스트 -> 온라인 인성검사 -> 면접 -> 최종합격..."
56cf1319fbe8132a,"전액무료 IT교육받고 취업하자(서울, 수원, 천안)",휴먼교육센터 서울 강남구,,문과정 소개 및 교육내용 모집지역 모집분야 교육대상 인원 서울교육센터 JAVA웹개발 분야 웹 퍼블리싱 분야 웹디자인 분야 빅데이터UI 개발 분야 AI... 통신·모바일·게임>응용프로그래머> JAVA|인터넷·IT·통신·모바일·게임...
16dff836029458af,"모바일 앱 서버 개발(Java, Python)",휴먼디지털 서울,,"User Interface, 모바일 UX 및 시스템 연구개발 업무내용 모바일 앱 서비스 서버 개발 (자바, Java, Python) 자격조건 - 정보시스템 설계 및 데이터 마이닝용 시스템 설계. - 모바일 앱 서비스용 서버..."
e0ea65eeea8c1c62,JAVA BackEnd Front End 개발자,5년차 솔루션 개발 중소기업 서울 장충동,,"JAVA BackEnd Front End 개발자 • 회사소개 - 5년차... 서울 중구 장충동 • 포지션 - 사세확장으로 인한 신규채용 - Java 백 엔드 개발자, 프론트 개발자 / 각 1명 - 직급 : 대리, 과장, 차장..."
8624753c574a9d25,Lead Application Backend Developer – Mob...,BOEING 서울,,"object oriented programming languages Expertise in Perl, Python, Java, Javascript, C/C++, C#, .Net, REST) Expertise in Oracle..."
fd2f650c2f0d4b5e,[메가존클라우드] 2020년 상반기 Commercial Tech 부문,메가존 서울 강남구,,"아키텍트 경력 - 영어 능통 - Java/Php/Python 등 개발 능통... 출물 축적 및 노하우 공유 - 개발 경력 3년 이상 - 다양한 개발 언어( JAVA, Python, Ruby, Node.js...등) 사용 및 이해가..."
b51ca785a45edf17,Senior Specialist Consultant - AI/ML,Amazon Web Services Korea LLC 서울,,"experience in software development in languages like Java, Python, Scala. Experience working with RESTful API and general..."
98b4004b386417f7,JAVA 프로그램 개발자(경력),이피피에스 서울 강남구,"연봉 34,000,000원 - 36,000,000원","랫폼 들을 활용한 비지니스애플리케이션 개발업무 HTML, CSS, JSP, jQuery, AngularJS, JAVA, Oracle, MSSQL, MySQL 상세모집요강 접수기간/방법 지원방법 전형절차 및 제출서류 제출..."
4d904be195e1682c,프로그램개발자(JAVA/HTML5/PowerBuilder/앱/.NET/P...,케이에스피소프트 서울 금천구,,(주)케이에스피소프트 프로그램개발자모집( JAVA/HTML5/PowerBuilder... 시스템분석·설계>ERP컨설팅|인터넷·IT·통신·모바일·게임>웹프로그래머> JAVA|인터넷·IT·통신·모바일·게임>웹프로그래머>.NET|인터넷·IT·통신...
d5a295604fb80d72,"JSP, JAVA 경력 정규직",모드니사회적협동조합 서울,,인터넷·IT·통신·모바일·게임>웹프로그래머>JSP|인터넷·IT·통신·모바일·게임>웹프로그래머> JAVA
92f04fc62c6d6a7a,"Technical Solutions Consultant, Android...",Google 4.3 서울,,"Coding experience... general purpose programming language (e.g. Java, C/C++, Python). Experience in managing strategic..."
f37ae5c355788540,Technical Account Manager- AMAZON Web Se...,Amazon Web Services Korea LLC 서울,,"DNS, TCP/IP, IPsec, BGP, VPN, Load Balancing) · Programming ( Java, Ruby, C#) · Distributed Computing · Database or Big Data..."
