ID,Title,Location,Salary,Summary
d7bdfa191a861fcc,Android 앱 개발 및 유지보수,휴먼디지털 서울,,"2년 이상(36세 이하) - Andorid 앱 개발 경력 - 하이브리드앱 서비스 런칭 경험 - HTML5, JAVA - MySQL 근무지 서울 연봉 회사내규에따름 모집기간 채용시 마감 전형방법 서류전형 후 면접 지원서류..."
7c211458de7cec92,웹 어플리케이션 개발 초급~중급,SW개발전문회사 서울 용산구,,"[담당업무] - 빅데이터 시스템 개발 및 운영 업무 [자격요건] - java, jsp 개발 가능자 - Spring프레임웍을 이용한 웹 어플리케이션 개발 가능자 - mysql 등 RDBS 개발 가능자 - hadoop 관련 구축..."
7ad3e0dd77472934,금융그룹 ICT서비스본부 웹 어플리케이션 개발 경력채용,ICT 개발 운영 정보보호 및 보안 서울 구로구,,"[담당업무] 여수신 시스템, 렌탈시스템 및 플렛폼 개발/운영 등 [자격요건] - 전문대 졸 이상 - 웹어플리케이션( Java/Jsp) 개발 경력 2년 이상 - 필요지식 및 역량 : 1) 전문대 졸업 이상 2) 웹 어플리케이션 개발..."
6d7826293a82bae4,"Mobile App (iOS, Android)",리테일-테크회사 서울 강남구,,자격요건 ] - 나이 : 20대 초반~30대 중반 - 경력 : 1년 이상 - Swift/Objective-C 나 Java 기반의 프로젝트 개발 경험 - 안드로이드나 iOS 중에서 네이티브 모바일 앱 개발 경력 - 팀 워크 및...
d24428ed26f0b058,디지털LAB 신기술파트,국내자본 저축은행 서울 구로구,,"[담당업무] 쳇봇, STT/TA/TTS, AI 일반 [자격요건] 4년제 정규 대졸 이상 Java, Python 프로그램 사용 가능 머신러닝(Tensorflow, DL4, Caffe,Theano) 프레임워크 기반 개발 능력 보유..."
5106d5f89c5eaa74,"앱개발자(Android, IOS) , 자체개발한 건설관련 스마트 안전앱...",피식스컨설팅 서울 금천구,,및 제출서류에 허위사실이 있을 경우 채용이 취소될 수 있습니다. 인터넷·IT·통신·모바일·게임>웹프로그래머> JAVA|인터넷·IT·통신·모바일·게임>웹프로그래머>프론트엔드|인터넷·IT·통신·모바일·게임>웹프로그래머>JSP...
ec27913a464b8c60,Senior Back-end Engineer (Transportation...,Coupang 3.1 서울,,엔터프라이즈 시스템(enterprise system) 구축을 위한 소프트웨어 개발 경력 5년 이상인 분 * Java 또는 기타 고급 언어를 사용하는 설계/코딩에 대한 견고한 기반이 있는 분 * 비즈니스를 능동적으로 해석하...
a0c163a746ae785b,디지털마케팅본부 디지털 BA팀장,국내자본 저축은행 서울 구로구,,"참여 - 웹 또는 App 개발 및 설계 경험자 - 다수의 SI프로젝트 수행했으며 커뮤니케이션 능력 우수자 - JAVA, React 사용 프로젝트 경험자(전체 업무 경험이 아닌,이해 수준도 가능) - 커뮤니케이션 능력 우수자..."
ca415e36c231517b,금융그룹 IT개발팀 시스템 개발 및 유지보수,ICT 개발 운영 정보보호 및 보안 서울 구로구,,"[담당업무] 렌탈ERP, 시스템 시뉴개발 & 유지보수 [자격요건] 전문대 졸 이상 JAVA, JSP, Javascript, PL & SQL 경력 3~4년 필수 넥사크로, 가우스 경험자 우대 * 개발3팀 구성은 상무님 총괄..."
962b5e66eba51115,빅데이터 플랫폼 개발,온라인결제 서울,,"[담당업무] -빅데이터 플랫폼 개발 [자격요건] - Java기반개발 경험 3년 이상 -오픈소스 소프트웨어 기반 개발 경험 -데이터수집,전처리,적재부분 개발 경험 -리눅스환경 개발 경험 [우대요건] -대용량 데이터분석시스템..."
5474affc60ca0c54,Software Engineer - Mobile (iOS/Android),Pixlee 서울,,areas are strongly encouraged: * Objective C/Swift * Java * Android Studio/Xcode/other modern mobile IDEs * Javascript/HTML...
b5b0a65d13df4183,Cloud Solution(MS Azure) Architect,유명 IT 유통사 서울 강남구,,용어를 이해하고 관련내용을 실제 구축 및 운영할 수 있는자. 우대 사항 ㆍweb... php/mysql/ java) 관련 개발 및 운영 유 경험자 우대 ㆍ 클라우드 기반 시스템 구축 및 운영 유 경험자 우대 . ms...
4b586c38c3c83e1c,저축은행 ICT 개발팀 전자금융 개발 및 유지보수,국내자본 저축은행 서울 구로구,,"뱅킹, 스마트뱅킹) 채널 개발 및 운영 [자격요건] - 4년제 정규 대졸 이상 - 프로그램 개발자 : JSP, JAVA, ORACLE/SQL,JS, Socket, OpenAPI, UNIX, LINUX 등 활용 가능자 - 여신..."
823357411538994c,LMS 물류시스템 개발 및 운영,국내 중견그룹 지주사 서울,,사내 LMS 재구축 및 물류시스템 운영 2) LMS 유지보수 등 [자격요건] - 4년제 정규 대졸 이상 - Java 중급 이상 (경력 4년 이상) - 물류시스템 관련 프로젝트 구축/운영 경험자 우대 - 식자재 물류 운영 및...
f84a0363293a3276,저축은행 ICT 개발팀 뱅킹시스템 개발 및 유지보수,국내자본 저축은행 서울 구로구,,"여신/수신 업무 개발 및 유지 보수 [자격요건] - 4년제 정규 대졸 이상 - 프로그램 개발자 : JSP, JAVA, ORACLE/SQL,JS, Socket, OpenAPI, UNIX, LINUX 등 활용 가능자 - 프로그램..."
94c8be7925a7be70,"로봇관련, R&D_User SW",4차산업 공장 자동화 기기 및 소프트웨어 경기도 수원,,D_User SW [담당업무] - Android 기반의 User Application 개발 [자격요건] - Java/Kotlin 기반 개발 역량 - TCP/IP 기반의 전문 통신 개발 역량 - 전산/컴퓨터공학 계열의 4...
cd53e929fc0f6ce3,웹 퍼블리셔/Front-End 개발자/Back-End 개발자 직원,리시드 서울 성동구,"연봉 25,000,000원","기본 지식이 있으신 분 3.Back-End 개발자(대리~과장급) - 관련분야 경력 3년 이상이신 분 - JAVA, PHP 등 개발언어 활용 능력이 있으신 분 - 웹서버 관리 및 운영이 가능하신 분 - Full-Stack..."
df7db7aea335e814,Software Engineer - Mobile 리더,리테일-테크회사 서울 강남구,,"및 최적화 경험 (예시 : Xcode profiling tool 등) - 안드로이드의 경우, Kotlin/ Java 기반의 프로젝트 개발 경험 혹은 빠르게 습득 할수 있는 능력 - iOS의 경우, Swift/Objective..."
62434fab1f0e2efe,개발PM,온라인결제 서울,,[담당업무] -개발PM 또는 PL [자격요건] - Java 기반 개발 프로젝트 PM/PM 경험 5년 이상 -하둡 기반 빅데이터 플랫폼 프로젝트 경험 -학사 이상 [우대요건] -하둡 외 다양한 빅데이터 DB 환경 경험 -협업도...
b23e63187a91d753,Android 개발,"모바일식권, 기업 식대관리 솔루션 서울 강남구",,"및 유지보수 [ 자격요건 ] - 경력 : 7년 이상 - 전공 : 컴퓨터 관련 전공자 - Android, Java 능통자 - 모바일 UI / UX에 대한 높은 이해도 - Android 최신 트랜드를 이용한 개발 경험 - 개발..."
a55478c1bee1cdc8,응용 프로그램 개발,쓰리뷰 성남 중원구,,[직무내용] C# or JAVA를 이용한 응용프로그램 개발 [근무시간 및... 통신·모바일·게임>응용프로그래머>C·C++|인터넷·IT·통신·모바일·게임>응용프로그래머> JAVA|인터넷·IT·통신·모바일·게임>응용프로그래머>C#
b7f7dcc3649070fd,저축은행 ICT 개발팀,국내자본 저축은행 서울 구로구,,"뱅킹, 스마트뱅킹) 채널 개발 및 운영 [자격요건] - 4년제 정규 대졸 이상 - 프로그램 개발자 : JSP, JAVA, ORACLE/SQL,JS, Socket, OpenAPI, UNIX, LINUX 등 활용 가능자 - 프로..."
f810ea173c182d43,자바(JAVA) 웹개발 경력직,온더아이티 성남 분당구,,"JAVA) 웹개발 경력직 모집 모집부문 및 자격요건 모집부문 담당업무 자격요건 인원 SW개발 sw엔지니어 웹개발 java [담당업무] 자바( JAVA... 명 응용 프로그래밍 C, C++, JAVA, 임베디드 개발 유경험자 네트워..."
c2776da0b5fbc276,Platform SW엔지니어,STB등 디바이스 개발 및 공급 성남 분당구,,"경력 3~10년 사원~과장급 -Skill : Programming language - C, C++, JAVA -외국어 : 고객 E-mail communication 문제 없는 수준, 고객 meeting 및 conference..."
2f3c39f93e5abf96,(주)신세계아이앤씨 상반기 AI/기획/데이터분석 부문 인재,신세계아이앤씨 서울 중구,,"Unreal 3D기반 개발경력 3년 이상 ※ 상기 요건 中 일부 경험자 지원가능 우대사항 -. C#/C/C++, Java 프로그래밍 개발경력 -. HMD 어플리케이션 개발 경력 ※ 공고부문은 채용부문별로 당사 제반사정에 따라..."
2362e9522d36bb2a,금융그룹 IT개발3팀 시스템 개발 및 유지보수,ICT 개발 운영 정보보호 및 보안 서울 구로구,,"ERP, 시스템 신규개발 및 유지보수 [자격요건] 전문대 졸 이상 시스템 개발 및 유지보수 경력 3~4년 JAVA, JSP, Javascript, PL & SQL 경험자 필수 넥사크로, 가우스 경험자 우대 * 개발3팀 구성은..."
dc0e756691b87299,[TmaxSoft/기술] Soft 기술지원 엔지니어,티맥스소프트 성남 분당구,,"기술 및 프로젝트 수행에 따른 기술 이슈 대응 고객사 제품 유지보수 비상주 프로젝트 수행 자격요건 C/ Java 기반의 프로젝트 개발 경험자 프레임워크, 인터페이스(FEP, EAI, MCI) 기반 프로젝트 개발 경험자..."
275f238967d5587f,저축은행 ICT운영팀 WAS 경력 채용,국내자본 저축은행 서울 구로구,,"Apahce / WebtoB / OHS 운영시스템 기술진단 및 최적화 튜닝, 장애원인 분석 및 조치 업무 - JAVA/JVM 성능 튜닝 등 [자격요건] - 4년제 정규 대졸 이상... 경력 5년~8년 - 금융권 근무경력..."
7fd822756481de4f,JAVA개발자,엔텔스 서울 강남구,,"4년) 성별 무관 기타 담당업무 JAVA개발자 모집 커리어 양식 지원 아직... 직무/산업 직무별(직종) 웹프로그래머웹프로그래머, JAVA 응용프로그래머응용프로그래머, 전산전공, Java 시스템프로그래머시스템프로그래머 산업별(업종..."
d56e72c8b47ac63a,"Senior, Back-end Engineer (Fintech platf...",Coupang 3.1 서울,,"API Gateway, Service Mesh 를 company-wide 적용 경험 * Strong Java, distributed systems, micro services, messaging services 전형 절차..."
d7e490bf343e5721,인공지능AI 기술연구개발(신입/경력),아이디어콘서트 성남 분당구,,"터마이징 가능자 -OpenCV 영상처리 라이브러리 유경험자 [우대조건] - java, jsp 경험자 -node.js 경험자 -Git 사용 가능자 -관련... 라이브러리 유경험자 [우대조건] - java, jsp 경험자 -node.js..."
830a019b35a02eee,"쇼핑몰관리, 웹디자이너",엘에스비그룹 서울 강남구,"연봉 24,000,000원","(주)엘에스비그룹 | 무역(수출, 수입), 컨설팅, 전자상거래 | 포토샵,플래시,일러스트,HTML·코딩,CSS, java,상품등록,운영보조,게시판관리,스타일리스트 | 계약직,인턴직 | 1년이상 | 월~금 | 조일근무 | 연봉 24..."
d0ed8660cd98f4c0,빅데이터 플랫폼 개발자,카카오 4.2 성남 판교역,,을 통한 데이터 클러스터링 및 abnormal 데이터 분석 지원자격 개발 경력 2년 이상 Pyrhon/ Java/Scala 등의 언어로 개발하실 수 있는 분 오픈소스와 빅데이터 플랫폼에 관심이 많으신 분 대용량 데이터...
ff650ca5454bb920,사업하고 싶은 야망있는 개발자,케어마인드 서울 강남구,,"유지보수 - 에포터 안드로이드 앱 확장 서비스 개발 - 에포터 안드로이드 앱 기획 참여 사용기술 - 언어: Java, Php - DB: MYSQL, Sqlite - 서버: 구글 클라우드 플랫폼 - 이미지처리: Glide..."
e1f69611698b1585,"JAVA, C언어 개발자",이지서티 서울 구로구,,"(주)이지서티 JAVA/C언어 솔루션개발자 신입 및 경력직 채용 JAVA솔루션개발자 모집요강 분 야 모집부문 담당업무 자격요건 및 우대사항 개발직군 ( JAVA) 솔루션 개발 - JAVA, C, JSP 개발자 - 빅데이터기반..."
430dbeed889014b6,JAVA 프로그램 개발자(신입),이피피에스 서울 강남구,"연봉 20,000,000원 - 22,000,000원","들을?활용한?비지니스애플리케이션?개발업무? HTML,?CSS,?JSP,?jQuery,?AngularJS,? JAVA,?Spring, Oracle,?MSSQL,?MySQL 상세모집요강 접수기간/방법 지원방법 전형절차 및..."
fb617eeb80ea6fa9,AI/빅데이터 분야 (인재 Pool),LG유플러스 3.8 서울,,"scikit-learn/Tensorflow 등) 능숙자 . Deep Learning Model 구현 경험자 . Java, Python등을 이용하여 분석을 위한 Data Manipulation (전처리, 분석 마트생성 등)경험..."
b88b3a4aadbe0eb4,(업계1위/복지우수) JAVA 개발자 경력직 공개 / 빅데이터 광고 플랫...,인라이플 서울 구로구,,인터넷·IT·통신·모바일·게임>응용프로그래머> JAVA|인터넷·IT·통신·모바일·게임>응용프로그래머>API|인터넷·IT·통신·모바일·게임>웹프로그래머> JAVA|인터넷·IT·통신·모바일·게임>웹프로그래머>백엔드|인터넷·IT·통신...
385c58c7ced1d77b,데이터 사이언티스트 지향하는 데이터 엔지니어,카카오 4.2 성남 판교역,,"Hive, Spark 등 빅데이터 분석 플랫폼을 사용하여 대용량 데이터의 수집,가공이 가능한 분 프로그램 개발( Java, python 등) 기술을 보유하신 분 직무 관련 경력 2년 이상 어떤 일이라도 중요하게 여기며 책임감..."
2df89ff4453791b3,[포스피드] 백앤드 개발 경력직 (정규직),헬로월드 서울 강남구,,4년 이상( ) [기본자격] - Java / Javascript 개발 역량... 게임>웹프로그래머>PHP |인터넷·IT·통신·모바일·게임>웹프로그래머> JAVA|인터넷·IT·통신·모바일·게임>웹프로그래머>EJB|인터넷·IT·통신...
072e19aecc5926bb,[메가존] 2020년 상반기 구글클라우드 직무별,메가존 서울 강남구,,"이터 가공 경험 (개발 언어를 일정 수준 다룰 수 있어야 함 eg : Java, Python) 또는 On Prem 의 서버 운영 경험 이나 VM... 통신·모바일·게임>웹프로그래머> JAVA|인터넷·IT·통신·모바일·게임>웹프..."
25b4adbf8d57ee3c,2020년 상반기 개발자 및 PM 경력직원,㈜정도유아이티 서울 강남구,,"모집분야] - 웹프로그램 개발자( Java) ﻿ [담당업무] - 공간정보... 담당업무] - JAVA + CS 프로그램 개발 - 자체 보유 엔진 개발 * Back End : Java(Spring Framework, mybatis..."
f1654437c1134807,모바일앱 제작 아르바이트,엘에스비그룹 서울 강남구,"시급 9,000원","(주)엘에스비그룹 | 무역(수출, 수입), 컨설팅, 전자상거래 | java,visual C,C#,웹프로그래머,응용프로그래머,시스템프로그래머,IT·디자인 기타 | 아르바이트,계약직 | 3개월~6개월 | 월~토 | 조일근무..."
07ad62f8295ca37f,2020년 분야별[신입/경력] 정규직,제이스퓨처 서울 구로구,,"무관 기타 담당업무 기획/마케팅, 개발- JAVA, JSP, PHP, C#... 웹마케팅.PM스토리보드 콘텐츠.사이트운영사이트운영 웹프로그래머JSP, JAVA, PHP 응용프로그래머응용프로그래머, C#, 안드로이드 산업별(업종..."
b55d3d20f915df43,(주)신세계아이앤씨 상반기 시스템운영/개발 부문 인재,신세계아이앤씨 서울 중구,,"그룹시스템 운영/개발 인원 00명 필수사항 -. Programming : Java, JSP, JavaScript, SQL, Shell Script 등... 통신·모바일·게임>응용프로그래머> JAVA|인터넷·IT·통신·모바일·게임..."
6ae8d397481c8472,(주)신세계아이앤씨 상반기 Infra/Server/Network/보안 부...,신세계아이앤씨 서울 중구,,"API 설계/개발, Container 기반 개발 등) -. 서버 가상화 Infra-Structure 이해 -. Java 개발 또는 Cording 개발 경험자 ※ 상기 요건 中 일부 경험자 지원가능 우대사항 -. 2개 이상..."
87c43e2a35c1e82f,"IT기술지원, S/W 엔지니어 외 신입/경력 정규직",지엑스에스 서울 종로구,,"관련 소프트웨어, B2B 분야 지원 업무 경력 선호. MS 윈도우즈/오피스, 리눅스/유닉스 운영 체제, Java 사용 기술. 데이터베이스, 네트워킹 관련 지식 보유자. (Oracle, SQL*Server, Firewalls..."
96379adfe8f3ae4e,JAVA Nexacro 인사시스템 개발-잠실,연우정보기술 서울 송파구,,"업무 자격요건 인원 [담당업무] [웹프로그래밍] 대기업 인사업무개발 잠실 JAVA 중급 20.4.1~6,8개월 [자격요건] 경력사항: 경력(6년 이상... 통신·모바일·게임>웹프로그래머> JAVA|인터넷·IT·통신·모바일·게임>웹프..."
5b535959b55b796c,1분기 Software Engineer,이스트게임즈 서울 서초구,,"C/C++, C#, Swift, Objective C, Kotlin, Java, JavaScript, Python, Go. - 새로운 프로그래밍 언어... 통신·모바일·게임>응용프로그래머> JAVA|인터넷·IT·통신·모바일·게임..."
696b655cc6ce3076,"JAVA, 웹개발자",캐디언스시스템글로벌 경기도 광명,"연봉 22,000,000원 - 24,000,000원","지원자격 경력 신입·경력 학력 - 성별 무관 기타 담당업무 아래와 같은 소프트웨어를 JAVA 등의 프로그래밍언어를 이용하여 개발합니다. -MES/POP -PLM -문서중앙화, ECM -기타 상세모집요강 접수기간/방법 지원..."
bfd23ce0ab1138c2,[허밍] 경력 디자이너,허밍IMC 서울 서초구,,"이지/배너/SNS카드뉴스 - edm 제작 및 발송(FTP, html 코딩) 코딩의 경우 기본 HTML코딩이며, java, c++같은 전문코딩은 아님. 2) 오프라인 디자인(옥외광고 및 각종 인쇄 디자인) - 카탈로그, 브로셔..."
a9ad21994c965531,"JAVA웹 중급개발자, 안드로이 중급 개발자 경력 정규직",솔게이트 서울 종로구,,및 내부 프로젝트 준비를 위해 중급 JAVA 웹 개발자를 충원하고 있습니다... JAVA웹 중급개발자 [자격요건] 경력사항: 경력(4년 이상 ) 학력사항: 초대졸 이상 -필수자격증:정보처리사 [필수사항] - JAVA Spring...
1662f47b5aae25da,"응용프로그래머, 웹프로그래머 외 경력 정규직, 계약직",아가도스 서울 강남구,"연봉 50,000,000원 - 60,000,000원","응용프로그램 android - java, jsp 등 모바일 개발 [근무부서... 인터넷·IT·통신·모바일·게임>웹프로그래머> JAVA|인터넷·IT·통신·모바일·게임>응용프로그래머> JAVA|인터넷·IT·통신·모바일·게임>응용프로그래머..."
02eec7e897483ba1,SC제일은행 디지털플랫폼팀 직원 채용(디자인/퍼블리싱/개발),한국스탠다드차타드은행 서울 공평동,,학교 졸업 이상의 학력보유자 - Html5/css3/jquery/javascript/JSP 스킬 보유자 - Java Server 프로그램 개발 스킬 보유자 - 관리자 WEB 개발/운영 유경험자 - 화면 개발 관련 업무...
06c3a6e421833ad1,"JAVA, JSP 경력 계약직, 프리랜서",모드니사회적협동조합 서울,,인터넷·IT·통신·모바일·게임>웹프로그래머> JAVA|인터넷·IT·통신·모바일·게임>웹프로그래머>JSP
eeb027369cdab361,분석 플랫폼 웹 프론트 엔지니어,Nexon 성남 분당구,,"Javascript 등 웹어플리케이션 개발을 위한 front-end 개발 가능 - Node, Python, C#, Java 중 최소 1개 언어에 대한 경험이 있는 분 - SQLServer, Mysql과 같은 RDBMS..."
3ecd87a745e7b526,경력,LG CNS 3.7 서울,,"솔루션 사용 경력 3년 이상 ② Java 등 개발 경력 3년 이상 우대사항... 웨어/ JAVA Application Framework 솔루션 개발(미들웨어/Framework 솔루션 기획, 개발, 기술지원 등) 필수요건 ① Java..."
a68056f9b2614197,[온라인공채] ZUM 빅데이터 분석 플랫폼 개발 및 운영(신입),미래에셋제5호기업인수목적 서울 서초구,,"기반한 의사결정 및 협업부서 업무 지원 자격조건 - Python, Java, Shell 등에 대해 능숙하게 다룰 수 있는 언어가 하나 이상 - 데이터... 통신·모바일·게임>응용프로그래머> JAVA|인터넷·IT·통신·모바일·게임..."
eece82ee393c4374,[TmaxSoft/기술] 제품 QA 신입/경력,티맥스소프트 성남 분당구,,"툴을 활용한 기능/비기능적 품질 관리 업무 지속적인 품질 관리 활동, 결함 분석 및 오류 보고 자격요건 Java 또는 C 언어를 이용하여 프로그래밍 가능자 IT 관련학과 전공자 우대사항 소프트웨어 테스트 또는 소프트웨..."
a00f2af874949858,[현대엘엔에스] 경력사원 공채,현대로보틱스 성남 분당구,,"망업무 어플리케이션 개발 자격요건 · 전산,자동화,산업공학 전공자 · ICT 업무 5년 이상 경력 보유자 · JAVA, C#, .Net, Oracle DB 경력자 ※ 우대사항 - WMS/WCS 등 물류분야 개발 경력자 주요..."
d48c925acb7e4187,IT기획(대리-과장급) 초빙 - 유명 유통사,로이스에이치알 서울,,"해도 . 프로젝트 관리 (PMP 등), 프로그래밍 언어 (Python, Java 등), RDBMS (OCP 등) 관련 자격증 우대 . 영어회화 가능자... 프로그래밍 언어 (Python, Java 등), RDBMS (OCP 등..."
3e2a310c9dd0f693,[멜론] 빅데이터 서비스 개발자,카카오 4.2 성남 판교역,,"등)을 활용한 데이터 시각화 서비스 개발 지원자격 Spring Framework 개발 경력 3년 이상 Java 언어 능숙 자료구조, 알고리즘, OS, 네트워크, SQL의 기초 지식 보유 긍정적이고 원활한 커뮤니케이션..."
69a13f350f720c10,"JAVA 신입/경력 정규직, 계약직",굿로 서울 금천구,,"(주)소프트랩스 JAVA 신입/경력 정규직, 계약직 채용 모집부문 및 자격요건 담당업무 자격요건 인원 [담당업무] JAVA 기반 웹 개발 [근무부서 및... 취소될 수 있습니다. 인터넷·IT·통신·모바일·게임>응용프로그래머> JAVA"
e4e36162481db73f,[인턴] RCS(Risk Consulting Services) 본부 Fo...,삼정 KPMG 3.3 서울 강남구,,"소프트웨어(EnCase, FTK, AXIOM 등) 사용 경험자 - 프로그래밍 및 스크립트(C, Python, Java, SQL 등) 사용 가능자 6. 전형절차 및 지원방법 - 1차: 서류전형 - 온라인 입사지원(http..."
16af988cd8210617,인사시스템 개발자,카카오 4.2 성남 판교역,,편의를 위한 시스템 개발 및 운영 향후 인사에 대한 인사이트를 제공할 시스템 설계 및 개발 지원자격 Java 및 Spring Framework에 대한 이해와 웹어플리케이션 개발 경험 (필수) OOP 기반 설계 및 구현...
67d626ca09b630e3,NXLog리포트팀 - 웹 프로그래머,Nexon 성남 분당구,,"데이터를 연동하고 외부에 전달하기 위한 API를 개발합니다. * 팀의 기술 스택 - Language : Java, TypeScript, JavaScript - Framework : Spring Boot, Angular..."
6f7012d86a9c4f76,삼성전자 C-lab 출신 기업 룰루랩 웹 플랫폼 개발자,룰루랩 서울 강남구,,"우대) [웹프로그래밍] - jsp, java, ASP / PHP 개발 능숙... DB서버 구축 및 유지 가능자 [응용 프로그래밍] - C, C++, JAVA, 임베디드 개발 유경험자 - .NET 프레임워크에 대한 기반 지식 보유자..."
a1c07e369c4a479e,소프트웨어 경력 계약직,강남구청 서울 강남구,"연봉 40,000,000원 - 50,000,000원",또는 전자정부프레임워크 기반 개발 JAVA경력자 우대 강남구청 소프트웨어... 교졸업 이상 기타: 스프링 프레임워크 또는 전자정부프레임워크 기반 개발 JAVA경력자 우대 1 명 근무조건 고용형태: 계약직(근무기간 5년) 근무부서...
5f252869bc42a429,[선릉/연3000만]IT Helpdesk/PC유지보수(경력/정규직),외국계기업 서울 강남구,"연봉 30,000,000원","외국계기업 | 금속 제조업 | java,C#,.NET,서버관리,네트워크관리,웹프로그래머,응용프로그래머,컴퓨터설치,컴퓨터조립 | 정규직 | 1년이상 | 주4일 | 조일근무 | 연봉 30,000,000 | 연령무관 | 2020-04-02"
b19575486d134ab7,BR&T Software Engineer Intern,BOEING 서울,,"Strong software development skills using Python, C, C++, Java, and Javascript etc (Preferred) Knowledge on aerospace..."
61ecdc0ef3cfb66a,[경력] 빅데이터 플랫폼 엔지니어,카카오 4.2 성남 판교역,,"및 도입 지원자격 5년 미만 경력자 <기술> 전산 전공 또는 그에 준하는 실무 경험을 갖추신 분 Java 필수, 그 외 Scala, Python, Ruby 중 1개 이상 언어로 개발 가능하신 분 하둡 플랫폼에 대한..."
ef98f90a8f290b00,[TmaxSoft/관리] 전사 정보시스템 설계 및 개발 관리,티맥스소프트 성남 분당구,,"TechNet, 홈페이지등 사내 시스템 관리 및 유지보수 자격요건 개발 3~6년 경력자(신입도 가능) jsp, java 프로그래밍 가능자, Spring 사용경험자 DB 관련 지식 보유자 우대사항 EIS(경영자정보..."
1dbf974fbe4e5628,애니파이브 - JAVA 개발자 경력직(정규직),애니파이브 서울 구로구,,"학력 대학졸업(2,3년) 성별 무관 기타 담당업무 (주)애니파이브 - JAVA 개발자 경력직(정규직) 채용 커리어 양식 지원 상세모집요강 접수기간... 직무별(직종) 웹프로그래머JSP, JAVA, MySQL, MS-SQL 응용..."
8a77ea973c5614ef,신입 R&D 연구원,스마트컨버전스 서울 중구,,"퇴직금"" 인터넷·IT·통신·모바일·게임>웹프로그래머>프론트엔드|인터넷·IT·통신·모바일·게임>웹프로그래머> JAVA|인터넷·IT·통신·모바일·게임>웹프로그래머>백엔드|인터넷·IT·통신·모바일·게임>응용프로그래머>C·C++|인터..."
f05461ef8ff5b381,Cloud Technical Account Manager- Program...,Oracle 3.8 서울,,"database and middleware platforms, Oracle Database WebLogic/ Java; Strong communication and presentation skills including..."
606646e13ad5c569,Solution Architect,Kinaxis 서울,,"Kinaxis, SAP, JDA, etc. * Technical skills... SQL, R, Java Script, Python, etc. If you want... part of a team..."
